lead_id,business_name,niche,city,state,website,public_phone,public_email,contact_url,owner_name,owner_title,owner_source,source_type,source_query,source_evidence,visible_gap,offer_angle,risk_score_1_5,validation_status,priority_tier,last_checked
LFR-20260614-0001,Bone Dry Commercial Roofing,roofing,Indianapolis,IN,https://bonedrycommercial.com/,+1-463-220-0401,,https://commercial.bonedry.com/free-estimate/,,,,overpass_public_business_record,Indianapolis IN roofing public business listing,"Public business record listed a phone number. Public business record listed a website. Website exposed a contact path at https://commercial.bonedry.com/free-estimate/. Website mentions estimate, quote, inspection, or scheduling language.",Public contact path appears to rely on phone-first routing without a clearly exposed email fallback.,Roofing lead-capture follow-up setup,2,validated_public_business_source,P0_offer_ready_review,2026-06-14
LFR-20260614-0002,Scott Waldman,roofing,Louisville,KY,,+1-502-442-0811,,,,,,overpass_public_business_record,Louisville KY roofing public business listing,Public business record listed a phone number.,"Public business listing is present, but no website was surfaced for a clear conversion path.",Website launch and roofing intake cleanup,4,partial_public_business_source,P1_manual_enrichment,2026-06-14
LFR-20260614-0003,Rodding Rooter,plumbing,Chicago,IL,https://roddingrooter.com/,+1-773-588-1200,roddingrooterchicago@gmail.com,,,,,overpass_public_business_record,Chicago IL plumbing public business listing,"Public business record listed a phone number. Public business record listed a website. Public website exposed email roddingrooterchicago@gmail.com. Website mentions estimate, quote, inspection, or scheduling language.","Website is live, but no obvious contact or estimate path was detected on the public page sweep.",Plumbing contact-path cleanup,2,validated_public_business_source,P0_offer_ready_review,2026-06-14
LFR-20260614-0004,Kuhn Plumbing,plumbing,Chicago,IL,https://www.kuhnplumbing.com/,+17735250474,info@kuhnplumbing.com,https://kuhnplumbing.com/contact/,,,,overpass_public_business_record,Chicago IL plumbing public business listing,"Public business record listed a phone number. Public business record listed a website. Public website exposed email info@kuhnplumbing.com. Website exposed a contact path at https://kuhnplumbing.com/contact/. Website mentions estimate, quote, inspection, or scheduling language.",Multiple public phone mentions may split the primary conversion path instead of pushing one clean estimate flow.,Plumbing primary-call routing cleanup,1,validated_public_business_source,P0_offer_ready_review,2026-06-14
LFR-20260614-0005,Rocket Plumbing,plumbing,Chicago,IL,https://rocketplumbingnow.com/north-park-plumber/,+1-773-906-7474,,https://connect.facebook.net/,,,,overpass_public_business_record,Chicago IL plumbing public business listing,"Public business record listed a phone number. Public business record listed a website. Website exposed a contact path at https://connect.facebook.net/. Website mentions estimate, quote, inspection, or scheduling language.",Public contact path appears to rely on phone-first routing without a clearly exposed email fallback.,Plumbing lead-capture follow-up setup,2,validated_public_business_source,P0_offer_ready_review,2026-06-14
LFR-20260614-0006,Altstadt Hoffman Plumbing Services,plumbing,Louisville,KY,https://www.altstadtplumbing.com/,+1-502-713-1987,,,,,,overpass_public_business_record,Louisville KY plumbing public business listing,Public business record listed a phone number. Public business record listed a website. Website did not return readable HTML during this run.,"Website is live, but no obvious contact or estimate path was detected on the public page sweep.",Plumbing contact-path cleanup,2,validated_public_business_source,P0_offer_ready_review,2026-06-14
LFR-20260614-0007,Blythe Heating & Cooling,hvac,Indianapolis,IN,https://blytheheating.com/,+1-317-828-1795,,https://www.blytheheating.com/contact.php,,,,overpass_public_business_record,Indianapolis IN hvac public business listing,"Public business record listed a phone number. Public business record listed a website. Website exposed a contact path at https://www.blytheheating.com/contact.php. Website mentions estimate, quote, inspection, or scheduling language.",Public contact path appears to rely on phone-first routing without a clearly exposed email fallback.,Hvac lead-capture follow-up setup,2,validated_public_business_source,P0_offer_ready_review,2026-06-14
LFR-20260614-0008,Vital Heating & Air,hvac,Indianapolis,IN,https://www.vitalheatingandair.com/,+1-317-868-2665,service@vitalheatingandair.com,https://www.vitalheatingandair.com/schedule-service,,,,overpass_public_business_record,Indianapolis IN hvac public business listing,"Public business record listed a phone number. Public business record listed a website. Public website exposed email service@vitalheatingandair.com. Website exposed a contact path at https://www.vitalheatingandair.com/schedule-service. Website mentions estimate, quote, inspection, or scheduling language.",Multiple public phone mentions may split the primary conversion path instead of pushing one clean estimate flow.,Hvac primary-call routing cleanup,1,validated_public_business_source,P0_offer_ready_review,2026-06-14