"lead_id","business_name","niche","city","state","website","public_phone","public_email","contact_url","owner_name","owner_title","owner_source","source_type","source_query","source_evidence","visible_gap","offer_angle","risk_score_1_5","validation_status","priority_tier","last_checked"
"LFR-20260614-0001","Pinnacle Roofing Group","roofing","Sanford","FL","https://pinnacleroofinggroup.com/","+1-386-631-5566","CS@pinnacleroofinggroup.com","https://pinnacleroofinggroup.com/free-estimate/","Justin Coltharp","Founder","https://pinnacleroofinggroup.com/","overpass_public_business_record","Sanford FL roofing public business listing","Public business record listed website and phone. Official website exposes a free-estimate path and domain email; official site says Justin Coltharp founded Pinnacle Roofing Group.","Multiple public phone/email/contact routes are visible, so estimate routing should be checked for one clean tracked path.","Roofing estimate routing and owner-routed follow-up cleanup","1","validated_public_business_source","P0_offer_ready_review","2026-06-14"
"LFR-20260614-0002","R. Howe Electric Inc","electrician","Sanford","FL","https://www.rhoweelectric.net/","+1-407-714-1341","Scheduler@rhoweelectric.net","https://www.rhoweelectric.net/contact/","Louis Y. Valsaint","Registered agent / operator contact","https://search.sunbiz.org/Inquiry/corporationsearch/SearchResultDetail?aggregateId=domp-p99000022972-51e8248f-5a2c-450c-9ab9-01ea5183f8fa&directionType=Initial&inquirytype=EntityName&listNameOrder=RHOWE+L150001343470&searchNameOrder=RHOWEELECTRIC+P990000229720&searchTerm=RHOWE+LLC","overpass_public_business_record","Sanford FL electrician public business listing","Public business record listed website and phone. Official contact page exposes scheduler@rhoweelectric.net and service phone; Sunbiz active corporation record lists Louis Y. Valsaint as registered agent for R. Howe Electric, Inc.","Website has strong service pages, but phone/email scheduling should be tracked against estimate requests to avoid missed booked jobs.","Electrician scheduling-path and quote tracking cleanup","1","validated_public_business_source","P0_offer_ready_review","2026-06-14"
"LFR-20260614-0003","Strada Services","hvac","Sanford","FL","https://stradaservices.com/","+1-833-539-7800","","https://stradaservices.com/contact-us/","Joe Strada","Founder / executive chairman","https://stradaservices.com/","overpass_public_business_record","Sanford FL hvac public business listing","Public business record listed website and phone. Official website names Joe Strada as Founder/Executive Chairman and exposes a first-party contact page with service-interest fields and Sanford headquarters.","Multi-trade contact form covers HVAC, electrical, plumbing, and security, so service-intent segmentation and follow-up routing should be audited.","Multi-trade booking segmentation and follow-up cleanup","2","validated_public_business_source","P1_offer_ready_review","2026-06-14"
"LFR-20260614-0004","Facemyer Air Conditioning and Heating","hvac","Sanford","FL","https://www.fixmyacnow.com/","+1-407-322-7455","","https://fixmyacnow.com/contact-us","Rod Facemyer and Stella Facemyer","Founders","https://fixmyacnow.com/about-us","overpass_public_business_record","Sanford FL hvac public business listing","Public business record listed website and phone. Official about page says Facemyer began as a small family business founded by Rod and Stella Facemyer; official contact page shows phone and service contact path.","Emergency-service phone path is clear, but estimate/contact tracking should be checked for after-hours and maintenance-plan follow-up.","HVAC emergency-call and maintenance-plan follow-up cleanup","1","validated_public_business_source","P0_offer_ready_review","2026-06-14"
"LFR-20260614-0005","Integrity Refrigeration and A/C","hvac","Winter Haven","FL","https://www.integrityrefrigerationandac.com/","+1-863-557-4608","","https://www.integrityrefrigerationandac.com/contact-us","William Louis Gregus II","Owner","https://www.bbb.org/us/fl/winter-haven/profile/air-conditioning-contractor/integrity-refrigeration-and-ac-service-llc-0733-235957840","overpass_public_business_record","Winter Haven FL hvac public business listing","Public business record listed website and phone. Official website exposes contact path and promotions; BBB profile lists William Louis Gregus II as owner and principal contact for Integrity Refrigeration and A/C LLC.","Contact path and promotions are present, but follow-up should connect seasonal offers to booked service or replacement opportunities.","HVAC promotion-to-booked-service follow-up cleanup","1","validated_public_business_source","P0_offer_ready_review","2026-06-14"
"LFR-20260614-0006","Egberts Air Conditioning & Heating Repair","hvac","Winter Haven","FL","https://egbertsair.com/near-me-hvac-contractor-winter-haven-fl/","+1-863-592-8655","","https://egbertsair.com/contact-us/","Justin Egbert","Owner / chamber contact","https://web.lakelandchamber.com/Air-ConditioningHeating","overpass_public_business_record","Winter Haven FL hvac public business listing","Public business record listed website and phone. Official website exposes a contact page and Winter Haven HVAC service page; Lakeland Chamber listing names Justin Egbert with Egberts Air Conditioning and Heating Repair.","Landing pages use multiple local service pages and phone numbers, so call attribution and quote routing should be tightened.","HVAC local landing-page call tracking cleanup","2","validated_public_business_source","P1_offer_ready_review","2026-06-14"
