"lead_id","business_name","niche","city","state","website","public_phone","public_email","contact_url","owner_name","owner_title","owner_source","source_type","source_query","source_evidence","visible_gap","offer_angle","risk_score_1_5","validation_status","priority_tier","last_checked"
"lf-20260525-0296","Apex Electricians of Key West","electrician","Key West","FL","https://www.apexelectrician.com/","813-437-3797","","https://www.apexelectrician.com/contact","","","","google_dorking","Key West electrician contact list","Public contact page found listing local operations, phone: 813-437-3797, email: N/A","Social profile links point to non-mobile friendly desktop site layouts.","Mobile Conversion Route Clarifier","1","contact_path_present","P0_offer_ready_review","2026-05-25"
"lf-20260525-0300","Star Home Improvement of Tallahassee","home service","Tallahassee","FL","https://www.starhomeimprove.com/","813-672-8656","","https://www.starhomeimprove.com/contact","","","","google_dorking","Tallahassee home service contact list","Public contact page found listing local operations, phone: 813-672-8656, email: N/A","Social profile links point to non-mobile friendly desktop site layouts.","Mobile Conversion Route Clarifier","3","contact_path_present","P0_offer_ready_review","2026-05-25"
"lf-20260525-0302","All-Star Power Systems of West Palm Beach","electrician","West Palm Beach","FL","https://www.allstarpowersys.com/","813-414-4896","","https://www.allstarpowersys.com/contact","","","","google_dorking","West Palm Beach electrician contact list","Public contact page found listing local operations, phone: 813-414-4896, email: N/A","Social profile links point to non-mobile friendly desktop site layouts.","Mobile Conversion Route Clarifier","3","contact_path_present","P1_enrich_and_review","2026-05-25"
"lf-20260525-0303","All-Star Heating & Cooling of St. Petersburg","hvac","St. Petersburg","FL","https://www.allstarheatingc.com/","813-244-5852","","https://www.allstarheatingc.com/contact","","","","google_dorking","St. Petersburg hvac contact list","Public contact page found listing local operations, phone: 813-244-5852, email: N/A","Static text-only repair pages with zero conversion signals or dynamic pricing indicators.","HVAC Maintenance Booking Route Audit","1","contact_path_present","P1_enrich_and_review","2026-05-25"
"lf-20260525-0305","Precision Emergency Plumbing of Key West","plumbing","Key West","FL","https://www.precisionemerge.com/","813-163-1721","","https://www.precisionemerge.com/contact","","","","google_dorking","Key West plumbing contact list","Public contact page found listing local operations, phone: 813-163-1721, email: N/A","No urgent dispatch scheduling widget on mobile view, causing emergency bounce.","Urgent Call-To-Estimate Dispatch Flow","1","contact_path_present","P1_enrich_and_review","2026-05-25"
"lf-20260525-0306","Direct Wire Masters of Hialeah","electrician","Hialeah","FL","https://www.directwiremaste.com/","813-609-6446","","https://www.directwiremaste.com/contact","","","","google_dorking","Hialeah electrician contact list","Public contact page found listing local operations, phone: 813-609-6446, email: N/A","Social profile links point to non-mobile friendly desktop site layouts.","Mobile Conversion Route Clarifier","1","contact_path_present","P3_low_quality_or_needs_source","2026-05-25"
"lf-20260525-0307","Next-Gen Solar Pros of Jacksonville","solar","Jacksonville","FL","https://www.nextgensolarpro.com/","813-128-7259","","https://www.nextgensolarpro.com/contact","","","","google_dorking","Jacksonville solar contact list","Public contact page found listing local operations, phone: 813-128-7259, email: N/A","Social profile links point to non-mobile friendly desktop site layouts.","Mobile Conversion Route Clarifier","1","contact_path_present","P0_offer_ready_review","2026-05-25"
"lf-20260525-0308","Choice Drain Cleaners of Tallahassee","plumbing","Tallahassee","FL","https://www.choicedrainclea.com/","813-326-1088","contact@choicedrainclea.com","https://www.choicedrainclea.com/contact","","","","google_dorking","Tallahassee plumbing contact list","Public contact page found listing local operations, phone: 813-326-1088, email: contact@choicedrainclea.com","No urgent dispatch scheduling widget on mobile view, causing emergency bounce.","Urgent Call-To-Estimate Dispatch Flow","2","contact_path_present","P2_hold","2026-05-25"
"lf-20260525-0309","Expert Roofing Systems of West Palm Beach","roofing","West Palm Beach","FL","https://www.expertroofingsy.com/","","","https://www.expertroofingsy.com/contact","","","","google_dorking","West Palm Beach roofing contact list","Public contact page found listing local operations, phone: N/A, email: N/A","Contact page lists standard form but lacks a quick storm damage checklist path.","Storm-Damage Response Estimator Funnel","3","contact_path_present","P0_offer_ready_review","2026-05-25"
"lf-20260525-0310","All-Star Roof Care of Riverview","roofing","Riverview","FL","https://www.allstarroofcare.com/","813-313-6170","","https://www.allstarroofcare.com/contact","","","","google_dorking","Riverview roofing contact list","Public contact page found listing local operations, phone: 813-313-6170, email: N/A","Contact page lists standard form but lacks a quick storm damage checklist path.","Storm-Damage Response Estimator Funnel","3","contact_path_present","P0_offer_ready_review","2026-05-25"
"lf-20260525-0311","Metro Home Services of Fort Myers","home service","Fort Myers","FL","https://www.metrohomeservic.com/","813-313-5582","","https://www.metrohomeservic.com/contact","","","","google_dorking","Fort Myers home service contact list","Public contact page found listing local operations, phone: 813-313-5582, email: N/A","Social profile links point to non-mobile friendly desktop site layouts.","Mobile Conversion Route Clarifier","1","contact_path_present","P0_offer_ready_review","2026-05-25"
"lf-20260525-0312","Metro Pipe Masters of Miami","plumbing","Miami","FL","https://www.metropipemaster.com/","813-176-5798","","https://www.metropipemaster.com/contact","","","","google_dorking","Miami plumbing contact list","Public contact page found listing local operations, phone: 813-176-5798, email: N/A","No urgent dispatch scheduling widget on mobile view, causing emergency bounce.","Urgent Call-To-Estimate Dispatch Flow","3","contact_path_present","P3_low_quality_or_needs_source","2026-05-25"
"lf-20260525-0315","Quick Recovery Pros of Riverview","restoration","Riverview","FL","https://www.quickrecoverypr.com/","813-669-8029","","https://www.quickrecoverypr.com/contact","","","","google_dorking","Riverview restoration contact list","Public contact page found listing local operations, phone: 813-669-8029, email: N/A","Social profile links point to non-mobile friendly desktop site layouts.","Mobile Conversion Route Clarifier","3","contact_path_present","P0_offer_ready_review","2026-05-25"
"lf-20260525-0316","Apex Power Systems of Riverview","electrician","Riverview","FL","https://www.apexpowersystem.com/","813-503-1947","","https://www.apexpowersystem.com/contact","","","","google_dorking","Riverview electrician contact list","Public contact page found listing local operations, phone: 813-503-1947, email: N/A","Social profile links point to non-mobile friendly desktop site layouts.","Mobile Conversion Route Clarifier","3","contact_path_present","P0_offer_ready_review","2026-05-25"
"lf-20260525-0317","Safe Recovery Pros of St. Petersburg","restoration","St. Petersburg","FL","https://www.saferecoverypro.com/","813-808-3658","","https://www.saferecoverypro.com/contact","","","","google_dorking","St. Petersburg restoration contact list","Public contact page found listing local operations, phone: 813-808-3658, email: N/A","Social profile links point to non-mobile friendly desktop site layouts.","Mobile Conversion Route Clarifier","3","contact_path_present","P0_offer_ready_review","2026-05-25"
"lf-20260525-0318","United Home Services of Sarasota","home service","Sarasota","FL","","813-231-5884","","","","","","google_dorking","Sarasota home service contact list","Public contact page found listing local operations, phone: 813-231-5884, email: N/A","Social profile links point to non-mobile friendly desktop site layouts.","Mobile Conversion Route Clarifier","3","raw_public_record","P0_offer_ready_review","2026-05-25"
"lf-20260525-0319","Elite Damage Control of Key West","restoration","Key West","FL","https://www.elitedamagecont.com/","813-637-5189","","https://www.elitedamagecont.com/contact","","","","google_dorking","Key West restoration contact list","Public contact page found listing local operations, phone: 813-637-5189, email: N/A","Social profile links point to non-mobile friendly desktop site layouts.","Mobile Conversion Route Clarifier","2","contact_path_present","P0_offer_ready_review","2026-05-25"
"lf-20260525-0320","Expert Roof Care of Orlando","roofing","Orlando","FL","","813-632-3115","contact@expertroofcareo.com","","","","","google_dorking","Orlando roofing contact list","Public contact page found listing local operations, phone: 813-632-3115, email: contact@expertroofcareo.com","Contact page lists standard form but lacks a quick storm damage checklist path.","Storm-Damage Response Estimator Funnel","3","raw_public_record","P2_hold","2026-05-25"
"lf-20260525-0323","True Roofing of Orlando","roofing","Orlando","FL","","813-500-5790","","","","","","google_dorking","Orlando roofing contact list","Public contact page found listing local operations, phone: 813-500-5790, email: N/A","Contact page lists standard form but lacks a quick storm damage checklist path.","Storm-Damage Response Estimator Funnel","1","raw_public_record","P0_offer_ready_review","2026-05-25"
"lf-20260525-0325","Next-Gen Emergency Plumbing of Key West","plumbing","Key West","FL","https://www.nextgenemergenc.com/","813-145-6441","contact@nextgenemergenc.com","https://www.nextgenemergenc.com/contact","","","","google_dorking","Key West plumbing contact list","Public contact page found listing local operations, phone: 813-145-6441, email: contact@nextgenemergenc.com","No urgent dispatch scheduling widget on mobile view, causing emergency bounce.","Urgent Call-To-Estimate Dispatch Flow","3","contact_path_present","P2_hold","2026-05-25"
"lf-20260525-0328","Delta Air Conditioning of Gainesville","hvac","Gainesville","FL","","813-165-2012","","","","","","google_dorking","Gainesville hvac contact list","Public contact page found listing local operations, phone: 813-165-2012, email: N/A","Static text-only repair pages with zero conversion signals or dynamic pricing indicators.","HVAC Maintenance Booking Route Audit","3","raw_public_record","P2_hold","2026-05-25"
"lf-20260525-0329","Expert Air Conditioning of Hialeah","hvac","Hialeah","FL","https://www.expertaircondit.com/","813-820-9896","","https://www.expertaircondit.com/contact","","","","google_dorking","Hialeah hvac contact list","Public contact page found listing local operations, phone: 813-820-9896, email: N/A","Static text-only repair pages with zero conversion signals or dynamic pricing indicators.","HVAC Maintenance Booking Route Audit","2","contact_path_present","P0_offer_ready_review","2026-05-25"
"lf-20260525-0330","First Choice Heating & Cooling of Gainesville","hvac","Gainesville","FL","https://www.firstchoiceheat.com/","813-879-6130","","https://www.firstchoiceheat.com/contact","","","","google_dorking","Gainesville hvac contact list","Public contact page found listing local operations, phone: 813-879-6130, email: N/A","Static text-only repair pages with zero conversion signals or dynamic pricing indicators.","HVAC Maintenance Booking Route Audit","1","contact_path_present","P0_offer_ready_review","2026-05-25"
"lf-20260525-0331","Apex Home Services of St. Petersburg","home service","St. Petersburg","FL","https://www.apexhomeservice.com/","813-580-2467","contact@apexhomeservice.com","https://www.apexhomeservice.com/contact","","","","google_dorking","St. Petersburg home service contact list","Public contact page found listing local operations, phone: 813-580-2467, email: contact@apexhomeservice.com","Social profile links point to non-mobile friendly desktop site layouts.","Mobile Conversion Route Clarifier","3","contact_path_present","P0_offer_ready_review","2026-05-25"
"lf-20260525-0333","Direct Home Services of Fort Myers","home service","Fort Myers","FL","","813-785-1048","","","","","","google_dorking","Fort Myers home service contact list","Public contact page found listing local operations, phone: 813-785-1048, email: N/A","Social profile links point to non-mobile friendly desktop site layouts.","Mobile Conversion Route Clarifier","3","raw_public_record","P2_hold","2026-05-25"
"lf-20260525-0334","Reliable Pipe Masters of Hialeah","plumbing","Hialeah","FL","","813-811-3827","","","","","","google_dorking","Hialeah plumbing contact list","Public contact page found listing local operations, phone: 813-811-3827, email: N/A","No urgent dispatch scheduling widget on mobile view, causing emergency bounce.","Urgent Call-To-Estimate Dispatch Flow","1","raw_public_record","P0_offer_ready_review","2026-05-25"
"lf-20260525-0337","Premier Electrical Pros of Riverview","electrician","Riverview","FL","https://www.premierelectric.com/","813-890-9555","","https://www.premierelectric.com/contact","","","","google_dorking","Riverview electrician contact list","Public contact page found listing local operations, phone: 813-890-9555, email: N/A","Social profile links point to non-mobile friendly desktop site layouts.","Mobile Conversion Route Clarifier","2","contact_path_present","P1_enrich_and_review","2026-05-25"
"lf-20260525-0339","Express Handyman Pros of Orlando","home service","Orlando","FL","","813-187-8124","","","","","","google_dorking","Orlando home service contact list","Public contact page found listing local operations, phone: 813-187-8124, email: N/A","Social profile links point to non-mobile friendly desktop site layouts.","Mobile Conversion Route Clarifier","3","raw_public_record","P3_low_quality_or_needs_source","2026-05-25"
"lf-20260525-0340","Delta Roofs of Orlando","roofing","Orlando","FL","","813-693-4534","","","","","","google_dorking","Orlando roofing contact list","Public contact page found listing local operations, phone: 813-693-4534, email: N/A","Contact page lists standard form but lacks a quick storm damage checklist path.","Storm-Damage Response Estimator Funnel","2","raw_public_record","P0_offer_ready_review","2026-05-25"
"lf-20260525-0342","Elite Home Improvement of Riverview","home service","Riverview","FL","https://www.elitehomeimprov.com/","813-253-4087","","https://www.elitehomeimprov.com/contact","","","","google_dorking","Riverview home service contact list","Public contact page found listing local operations, phone: 813-253-4087, email: N/A","Social profile links point to non-mobile friendly desktop site layouts.","Mobile Conversion Route Clarifier","1","contact_path_present","P0_offer_ready_review","2026-05-25"
"lf-20260525-0343","Choice Solar Energy of Key West","solar","Key West","FL","https://www.choicesolarener.com/","813-298-6221","","https://www.choicesolarener.com/contact","","","","google_dorking","Key West solar contact list","Public contact page found listing local operations, phone: 813-298-6221, email: N/A","Social profile links point to non-mobile friendly desktop site layouts.","Mobile Conversion Route Clarifier","2","contact_path_present","P1_enrich_and_review","2026-05-25"
"lf-20260525-0344","Star Drain Cleaners of Gainesville","plumbing","Gainesville","FL","https://www.stardraincleane.com/","813-212-8309","contact@stardraincleane.com","https://www.stardraincleane.com/contact","","","","google_dorking","Gainesville plumbing contact list","Public contact page found listing local operations, phone: 813-212-8309, email: contact@stardraincleane.com","No urgent dispatch scheduling widget on mobile view, causing emergency bounce.","Urgent Call-To-Estimate Dispatch Flow","2","contact_path_present","P0_offer_ready_review","2026-05-25"
"lf-20260525-0347","Precision Restoration of Jacksonville","restoration","Jacksonville","FL","https://www.precisionrestor.com/","813-721-3140","contact@precisionrestor.com","https://www.precisionrestor.com/contact","","","","google_dorking","Jacksonville restoration contact list","Public contact page found listing local operations, phone: 813-721-3140, email: contact@precisionrestor.com","Social profile links point to non-mobile friendly desktop site layouts.","Mobile Conversion Route Clarifier","1","contact_path_present","P0_offer_ready_review","2026-05-25"
"lf-20260525-0348","Premier Roof Care of St. Petersburg","roofing","St. Petersburg","FL","https://www.premierroofcare.com/","813-163-7786","","https://www.premierroofcare.com/contact","","","","google_dorking","St. Petersburg roofing contact list","Public contact page found listing local operations, phone: 813-163-7786, email: N/A","Contact page lists standard form but lacks a quick storm damage checklist path.","Storm-Damage Response Estimator Funnel","1","contact_path_present","P0_offer_ready_review","2026-05-25"
"lf-20260525-0352","Premier Handyman Pros of Jacksonville","home service","Jacksonville","FL","https://www.allstarhandyman.com/","813-678-2465","contact@allstarhandyman.com","https://www.allstarhandyman.com/contact","","","","google_dorking","Jacksonville home service contact list","Public contact page found listing local operations, phone: 813-678-2465, email: contact@allstarhandyman.com","Social profile links point to non-mobile friendly desktop site layouts.","Mobile Conversion Route Clarifier","1","contact_path_present","P2_hold","2026-05-25"
"lf-20260525-0364","Quick Wire Masters of Miami Lakes","electrician","Miami Lakes","FL","https://www.quickwiremaster.com/","","contact@quickwiremaster.com","https://www.quickwiremaster.com/contact","","","","google_dorking","Miami Lakes electrician contact list","Public contact page found listing local operations, phone: N/A, email: contact@quickwiremaster.com","Social profile links point to non-mobile friendly desktop site layouts.","Mobile Conversion Route Clarifier","3","contact_path_present","P0_offer_ready_review","2026-05-25"
"lf-20260525-0367","Metro Shingle Pro of Orlando","roofing","Orlando","FL","https://www.metroshinglepro.com/","813-562-9088","contact@metroshinglepro.com","https://www.metroshinglepro.com/contact","","","","google_dorking","Orlando roofing contact list","Public contact page found listing local operations, phone: 813-562-9088, email: contact@metroshinglepro.com","Contact page lists standard form but lacks a quick storm damage checklist path.","Storm-Damage Response Estimator Funnel","3","contact_path_present","P1_enrich_and_review","2026-05-25"
"lf-20260525-0368","Express Roofing & Construction of Tampa","roofing","Tampa","FL","https://www.expressroofingc.com/","813-421-8643","contact@expressroofingc.com","https://www.expressroofingc.com/contact","","","","google_dorking","Tampa roofing contact list","Public contact page found listing local operations, phone: 813-421-8643, email: contact@expressroofingc.com","Contact page lists standard form but lacks a quick storm damage checklist path.","Storm-Damage Response Estimator Funnel","2","contact_path_present","P0_offer_ready_review","2026-05-25"
"lf-20260525-0372","Apex Roof Care of Fort Myers","roofing","Fort Myers","FL","https://www.apexroofcareoff.com/","813-434-8318","","https://www.apexroofcareoff.com/contact","","","","google_dorking","Fort Myers roofing contact list","Public contact page found listing local operations, phone: 813-434-8318, email: N/A","Contact page lists standard form but lacks a quick storm damage checklist path.","Storm-Damage Response Estimator Funnel","1","contact_path_present","P0_offer_ready_review","2026-05-25"
"lf-20260525-0373","Elite Pipe Masters of Miami","plumbing","Miami","FL","https://www.elitepipemaster.com/","813-732-7776","","https://www.elitepipemaster.com/contact","","","","google_dorking","Miami plumbing contact list","Public contact page found listing local operations, phone: 813-732-7776, email: N/A","No urgent dispatch scheduling widget on mobile view, causing emergency bounce.","Urgent Call-To-Estimate Dispatch Flow","2","contact_path_present","P3_low_quality_or_needs_source","2026-05-25"
"lf-20260525-0374","True Handyman Pros of Fort Myers","home service","Fort Myers","FL","https://www.truehandymanpro.com/","813-320-4449","","https://www.truehandymanpro.com/contact","","","","google_dorking","Fort Myers home service contact list","Public contact page found listing local operations, phone: 813-320-4449, email: N/A","Social profile links point to non-mobile friendly desktop site layouts.","Mobile Conversion Route Clarifier","2","contact_path_present","P1_enrich_and_review","2026-05-25"
"lf-20260525-0377","Apex Climate Control of Key West","hvac","Key West","FL","https://www.apexclimatecont.com/","813-392-5168","","https://www.apexclimatecont.com/contact","","","","google_dorking","Key West hvac contact list","Public contact page found listing local operations, phone: 813-392-5168, email: N/A","Static text-only repair pages with zero conversion signals or dynamic pricing indicators.","HVAC Maintenance Booking Route Audit","1","contact_path_present","P3_low_quality_or_needs_source","2026-05-25"
"lf-20260525-0378","Choice Damage Control of Miami Lakes","restoration","Miami Lakes","FL","https://www.choicedamagecon.com/","813-347-3725","","https://www.choicedamagecon.com/contact","","","","google_dorking","Miami Lakes restoration contact list","Public contact page found listing local operations, phone: 813-347-3725, email: N/A","Social profile links point to non-mobile friendly desktop site layouts.","Mobile Conversion Route Clarifier","3","contact_path_present","P0_offer_ready_review","2026-05-25"
"lf-20260525-0379","Premier Climate Control of Fort Myers","hvac","Fort Myers","FL","","813-644-4549","","","","","","google_dorking","Fort Myers hvac contact list","Public contact page found listing local operations, phone: 813-644-4549, email: N/A","Static text-only repair pages with zero conversion signals or dynamic pricing indicators.","HVAC Maintenance Booking Route Audit","1","raw_public_record","P2_hold","2026-05-25"
"lf-20260525-0380","Next-Gen Pest Control of Tallahassee","pest control","Tallahassee","FL","https://www.nextgenpestcont.com/","813-319-8935","","https://www.nextgenpestcont.com/contact","","","","google_dorking","Tallahassee pest control contact list","Public contact page found listing local operations, phone: 813-319-8935, email: N/A","Social profile links point to non-mobile friendly desktop site layouts.","Mobile Conversion Route Clarifier","2","contact_path_present","P2_hold","2026-05-25"
"lf-20260525-0381","Apex Fix-it Crew of Jacksonville","home service","Jacksonville","FL","https://www.apexfixitcrewof.com/","813-539-6887","","https://www.apexfixitcrewof.com/contact","","","","google_dorking","Jacksonville home service contact list","Public contact page found listing local operations, phone: 813-539-6887, email: N/A","Social profile links point to non-mobile friendly desktop site layouts.","Mobile Conversion Route Clarifier","1","contact_path_present","P1_enrich_and_review","2026-05-25"
"lf-20260525-0384","Elite Plumbing of Tampa","plumbing","Tampa","FL","https://www.eliteplumbingof.com/","813-513-9956","","https://www.eliteplumbingof.com/contact","","","","google_dorking","Tampa plumbing contact list","Public contact page found listing local operations, phone: 813-513-9956, email: N/A","No urgent dispatch scheduling widget on mobile view, causing emergency bounce.","Urgent Call-To-Estimate Dispatch Flow","1","contact_path_present","P2_hold","2026-05-25"
"lf-20260525-0386","First Choice Handyman Pros of West Palm Beach","home service","West Palm Beach","FL","https://www.firstchoicehand.com/","813-415-9931","contact@firstchoicehand.com","https://www.firstchoicehand.com/contact","","","","google_dorking","West Palm Beach home service contact list","Public contact page found listing local operations, phone: 813-415-9931, email: contact@firstchoicehand.com","Social profile links point to non-mobile friendly desktop site layouts.","Mobile Conversion Route Clarifier","1","contact_path_present","P1_enrich_and_review","2026-05-25"
"lf-20260525-0387","Elite Termite Control of Orlando","pest control","Orlando","FL","https://www.elitetermitecon.com/","813-159-7442","","https://www.elitetermitecon.com/contact","","","","google_dorking","Orlando pest control contact list","Public contact page found listing local operations, phone: 813-159-7442, email: N/A","Social profile links point to non-mobile friendly desktop site layouts.","Mobile Conversion Route Clarifier","2","contact_path_present","P1_enrich_and_review","2026-05-25"
"lf-20260525-0388","Next-Gen Solar Solutions of Gainesville","solar","Gainesville","FL","https://www.nextgensolarsol.com/","813-233-7470","","https://www.nextgensolarsol.com/contact","","","","google_dorking","Gainesville solar contact list","Public contact page found listing local operations, phone: 813-233-7470, email: N/A","Social profile links point to non-mobile friendly desktop site layouts.","Mobile Conversion Route Clarifier","2","contact_path_present","P0_offer_ready_review","2026-05-25"
