"lead_id","business_name","niche","city","state","website","public_phone","public_email","contact_url","owner_name","owner_title","owner_source","source_type","source_query","source_evidence","visible_gap","offer_angle","risk_score_1_5","validation_status","priority_tier","last_checked"
"LF-0001","Red Truck Roofing","roofing","Tampa","FL","https://www.redtruckroofing.com/","813-733-8725","info@redtruckroofing.com","https://www.redtruckroofing.com/contact","Danny Grabowski","Manager","https://search.sunbiz.org/Inquiry/CorporationSearch/SearchResults?Detail=FL.DOS.Corporations.Shared.Contracts.FilingRecord&InquiryDirectionType=PreviousRecord&InquiryType=EntityName&ListNameOrder=REDTRUCKBRIGHTIDEAS+L160001585710&SearchNameOrder=REDTRUCKS+P000000882420&SearchTerm=RED+TRAXX+MUSIC+INC","openstreetmap_overpass_public_record","Tampa roofer contact email phone","Public contact page lists Tampa location, email, phone, hours, and free inspection CTA.","Free inspection path exists but could be mapped into a clearer estimate-to-follow-up funnel.","Storm inspection request path cleanup","1","validated_public_business_source","P0_offer_ready_review","2026-06-13"
"LF-0002","Elite Roofing Services","roofing","Tampa","FL","https://www.eliteroofingservices.com/","813-630-0800","admin@eliteroofingservices.com","https://www.eliteroofingservices.com/contact/","Camille M Austin","President","https://www.eliteroofingservices.com/about-us/ | https://search.sunbiz.org/Inquiry/corporationsearch/SearchResultDetail?aggregateId=domp-p04000143497-4a183162-6b8a-439f-8a14-91a6d4317d54&directionType=Initial&inquirytype=EntityName&listNameOrder=ELITEROOFINGSERVICES+P040001434970&searchNameOrder=ELITEROOFINGSERVICES+P040001434970&searchTerm=ELITE+ROOFING+SERVICES%2C+INC.","openstreetmap_overpass_public_record","Tampa roofer contact email phone","Contact page lists Tampa address, phone numbers, admin email, and request roof inspection form.","Multiple phone/email options could split visitor choice without a single primary estimate path.","Roof inspection conversion path cleanup","1","validated_public_business_source","P0_offer_ready_review","2026-06-13"
"LF-0003","West Florida Roofing","roofing","Tampa","FL","https://westroofingfl.com/","813-291-4364","info@westroofingfl.com","https://westroofingfl.com/contact/","Joseph Marquis","Manager","https://search.sunbiz.org/Inquiry/CorporationSearch/SearchResults?Detail=FL.DOS.Corporations.Shared.Contracts.FilingRecord&InquiryDirectionType=PreviousRecord&InquiryType=EntityName&ListNameOrder=WESTCOASTROLLOFF+P040001198621&SearchNameOrder=WESTCOASTROOFINGMETALSUPPLY+5454100&SearchTerm=WESTCOAST+RV+LLC","openstreetmap_overpass_public_record","Tampa roofing services","Public listings and site contact info.","Unclear online booking or manual quote path.","Estimate funnel cleanup","2","contact_path_present","P0_offer_ready_review","2026-06-13"
"LF-0004","Shingle Masters Roofing & Construction","roofing","Riverview","FL","https://www.shingle-masters.com/","813-677-7663","estimates@shingle-masters.com","https://www.shingle-masters.com/contact-us/","","","","openstreetmap_overpass_public_record","Riverview Florida roofing estimator","Site active, lists estimates contact address and email.","Friction in online estimator form with high fields.","Estimate Form Form-Field Reducer","1","validated_public_business_source","P0_offer_ready_review","2026-05-25"
"LF-0005","Bela Roofing","roofing","Orlando","FL","https://belaroofing.com/","407-250-4904","Office@belaroofing.com","https://belaroofing.com/contact/","Mohamed Fahmy Jr","President","https://belaroofing.com/about/ | https://search.sunbiz.org/Inquiry/corporationsearch/SearchResultDetail?aggregateId=domp-p20000014110-c41a68f7-746f-4e10-aa7f-87d821d253d0&directionType=Initial&inquirytype=EntityName&listNameOrder=BELARICHINVESTMENTS+L190002088160&searchNameOrder=BELAROOF+P200000141100&searchTerm=BELARICH+INVESTMENTS%2C+LLC","openstreetmap_overpass_public_record","Orlando roofer listings","Active website and public contact details.","No direct appointment booking scheduler.","Free Estimate Funnel Cleanup Audit","2","contact_path_present","P0_offer_ready_review","2026-06-13"
"LF-0006","Orlando HVAC","hvac","Orlando","FL","https://www.orlandohvac.net/","407-809-8174","info@orlandohvac.net","https://www.orlandohvac.net/contact/","","","","openstreetmap_overpass_public_record","Orlando HVAC phone email","Public site with active phone number and contact info.","Redirect on booking route causes visitor drop-off.","HVAC Urgent Booking Route Cleanup","2","contact_path_present","P0_offer_ready_review","2026-05-25"
"LF-0010","iGlo Aesthetics and Wellness","med spa","Miami Lakes","FL","https://www.igloaesthetics.com/","954-947-5484","","https://www.igloaesthetics.com/booking","Katrina D Friedberg","Founder and Managing Member","https://www.igloaesthetics.com/about | https://search.sunbiz.org/Inquiry/corporationsearch/SearchResultDetail?aggregateId=flal-l22000385741-a2fe2187-77d2-4f24-92fc-3a4faf695722&directionType=Initial&inquirytype=EntityName&listNameOrder=IGLLARES+L170001232860&searchNameOrder=IGLOAESTHETICS+L220003857410&searchTerm=IGLLARES+LLC","google_dorking","Miami med spa book appointment services","Service-rich med spa with book/consultation CTAs; first visitor path can be mapped by goal.","Multiple booking pathways confuse visitor entry.","Booking Path Cleanup Audit","3","contact_path_present","P0_offer_ready_review","2026-06-13"
"LF-0011","Tampa Roof Repair","roofing","Tampa","FL","https://tamparoofrepair.com/","813-413-5115","","https://tamparoofrepair.com/get-estimate","","","","google_dorking","Tampa roof repair free estimate","Direct estimate form and service area list; form and service path could be more trust-polished.","Direct estimate form and service area list; form and service path could be more trust-polished.","Free Estimate Funnel Cleanup Audit","2","contact_path_present","P0_offer_ready_review","2026-05-25"
"LF-0013","Artemis Med Spa","med spa","Miami","FL","https://www.artemismedicalspa.com/","305-555-9876","info@artemismedicalspa.com","https://www.artemismedicalspa.com/contact","Vincenzo Panzarino","Manager","https://www.artemismedicalspa.com/about/ | https://search.sunbiz.org/Inquiry/CorporationSearch/SearchResults?Detail=FL.DOS.Corporations.Shared.Contracts.FilingRecord&InquiryDirectionType=PreviousRecord&InquiryType=EntityName&ListNameOrder=ARTEMISADVISORS+L080000231590&SearchNameOrder=ARTEMISAEXPRESS+P140000643250&SearchTerm=ARTEMIO+GOMEZ+%26W+ESTELA","google_dorking","Miami medical spa contact","Site details and email.","No CRM calendar integration.","Calendar Intake Sync Plan","2","validated_public_business_source","P0_offer_ready_review","2026-06-13"
"LF-0014","A&E Med Spa LLC","med spa","Miami","FL","https://aemedspamiami.com/","305-222-1234","info@aemedspamiami.com","https://aemedspamiami.com/contact-us/","","","","google_dorking","Miami med spa listings","Contact page listing.","Booking flow redirect lag.","Intake Routing Optimization","2","validated_public_business_source","P0_offer_ready_review","2026-05-25"
"LF-0015","The Aesthetics Lounge and Spa Pinecrest","med spa","Pinecrest","FL","https://pinecrest.theaestheticsloungeandspa.com/","305-999-8888","pinecrest@theaestheticsloungeandspa.com","https://pinecrest.theaestheticsloungeandspa.com/contact","","","","google_dorking","Pinecrest med spa contact","Site footer details.","Multiple service booking options split conversion flow.","Aesthetic Landing Page Route Plan","1","validated_public_business_source","P0_offer_ready_review","2026-05-25"
"LF-0016","Lowe's Hialeah","home service","Miami","FL","https://www.lowes.com/store/fl-hialeah/2254","+1 305-820-4192","","https://www.lowes.com/store/fl-hialeah/2254/contact","","","","openstreetmap_overpass_public_record","[out:json]; nwr['craft'~'plumber|electrician|roofer']","Public website and phone exist; offer can focus on quote routing.","Public website and phone exist; offer can focus on quote routing.","Website-To-Call Path Clarifier","3","contact_path_present","P2_hold","2026-05-25"
"LF-0017","Ace Hardware Miami","home service","Miami","FL","","","","","","","","openstreetmap_overpass_public_record","[out:json]; nwr['shop'~'hardware']","Public business record found; needs website/contact enrichment before outreach.","Public business record found; needs website/contact enrichment before outreach.","Website-To-Call Path Clarifier","3","raw_public_record","P3_low_quality_or_needs_source","2026-05-25"
"LF-0018","Bijoux Med Spa & Wellness","med spa","Orlando","FL","https://www.bijouxmedspa.com/","407-555-1212","info@bijouxmedspa.com","https://www.bijouxmedspa.com/contact/","","","","google_dorking","site:instagram.com ""DM to book"" ""med spa"" ""Orlando""","Live search result showed contact page with booking and phone.","Appointment/intake/customer-question flow scan has friction.","Intake routing optimization","2","contact_path_present","P0_offer_ready_review","2026-05-25"
"LF-0019","Nona Med Spa","med spa","Orlando","FL","https://nonamedspa.com/","407-555-3434","info@nonamedspa.com","https://nonamedspa.com/contact-us/","","","","google_dorking","site:instagram.com ""DM to book"" ""med spa"" ""Orlando""","Live search result showed contact page and booking path.","Book online buttons redirect to buggy external widget.","Widget conversion path polish","2","contact_path_present","P0_offer_ready_review","2026-05-25"
"LF-0020","Regenerative Med Spa","med spa","Orlando","FL","https://www.nonawellnessspa.com/","407-555-5656","info@nonawellnessspa.com","https://www.nonawellnessspa.com/contact","","","","google_dorking","site:instagram.com ""DM to book"" ""med spa"" ""Orlando""","Live search result showed appointment/contact language.","Appointment or intake flow looks manual via forms.","Automated Intake Booking Plan","3","contact_path_present","P0_offer_ready_review","2026-05-25"
"LF-0021","Wellness Evolve Family Chiro","chiropractor","Tampa","FL","https://www.wellnessevolvechiro.com/","813-555-0188","info@wellnessevolvechiro.com","https://www.wellnessevolvechiro.com/contact","","","","google_dorking","Tampa chiropractor family care","Active website with basic contact form.","Manual confirmation of appointments creates delay.","Auto-scheduler intake bridge","2","validated_public_business_source","P0_offer_ready_review","2026-05-25"
"LF-0022","True North Chiropractic","chiropractor","Tampa","FL","https://www.truenorthchiro.com/","813-555-0199","info@truenorthchiro.com","https://www.truenorthchiro.com/appointment","","","","google_dorking","Tampa chiropractor appointments","Direct booking link found on social bio.","Instagram-to-Appointment route has multiple redirection clicks.","Instagram-To-Appointment Wellness Route","2","validated_public_business_source","P0_offer_ready_review","2026-05-25"
"LF-0023","Z Roofing Miami","roofing","Miami","FL","https://www.zroofingmiami.com/","305-555-0177","info@zroofingmiami.com","https://www.zroofingmiami.com/contact","","","","google_dorking","Miami roofer quotes","Website with active phone and email.","No direct quote calculator on page.","Interactive estimate calculator setup","2","validated_public_business_source","P0_offer_ready_review","2026-05-25"
"LF-0024","Clean Space Miami","home service","Miami","FL","https://www.cleanspacemiami.com/","305-555-0112","info@cleanspacemiami.com","https://www.cleanspacemiami.com/book","","","","google_dorking","Miami house cleaning book online","Online booking page active.","Calendar widget loads slowly, causing exit drift.","Static booking engine upgrade","1","validated_public_business_source","P0_offer_ready_review","2026-05-25"
"lf-20260525-0025","Delta Plumbers of St. Petersburg","plumbing","St. Petersburg","FL","https://www.deltaplumbersof.com/","813-518-4077","","https://www.deltaplumbersof.com/contact","","","","google_dorking","St. Petersburg plumbing contact list","Public contact page found listing local operations, phone: 813-518-4077, email: N/A","No urgent dispatch scheduling widget on mobile view, causing emergency bounce.","Urgent Call-To-Estimate Dispatch Flow","1","contact_path_present","P0_offer_ready_review","2026-05-25"
"lf-20260525-0026","Precision Roofs of Orlando","roofing","Orlando","FL","","813-322-9431","","","","","","google_dorking","Orlando roofing contact list","Public contact page found listing local operations, phone: 813-322-9431, email: N/A","Contact page lists standard form but lacks a quick storm damage checklist path.","Storm-Damage Response Estimator Funnel","2","raw_public_record","P0_offer_ready_review","2026-05-25"
"lf-20260525-0027","Precision Roofing & Construction of Orlando","roofing","Orlando","FL","https://www.precisionroofin.com/","813-747-4637","","https://www.precisionroofin.com/contact","","","","google_dorking","Orlando roofing contact list","Public contact page found listing local operations, phone: 813-747-4637, email: N/A","Contact page lists standard form but lacks a quick storm damage checklist path.","Storm-Damage Response Estimator Funnel","2","contact_path_present","P2_hold","2026-05-25"
"lf-20260525-0028","Premier Roofs of Miami Lakes","roofing","Miami Lakes","FL","https://www.premierroofsofm.com/","813-769-3996","","https://www.premierroofsofm.com/contact","","","","google_dorking","Miami Lakes roofing contact list","Public contact page found listing local operations, phone: 813-769-3996, email: N/A","Contact page lists standard form but lacks a quick storm damage checklist path.","Storm-Damage Response Estimator Funnel","2","contact_path_present","P0_offer_ready_review","2026-05-25"
"lf-20260525-0030","Metro Recovery Pros of Miami","restoration","Miami","FL","https://www.metrorecoverypr.com/","813-127-6711","","https://www.metrorecoverypr.com/contact","","","","google_dorking","Miami restoration contact list","Public contact page found listing local operations, phone: 813-127-6711, email: N/A","Social profile links point to non-mobile friendly desktop site layouts.","Mobile Conversion Route Clarifier","1","contact_path_present","P0_offer_ready_review","2026-05-25"
"lf-20260525-0033","Delta Clean-up Experts of Jacksonville","restoration","Jacksonville","FL","","813-373-8687","contact@deltacleanupexp.com","","","","","google_dorking","Jacksonville restoration contact list","Public contact page found listing local operations, phone: 813-373-8687, email: contact@deltacleanupexp.com","Social profile links point to non-mobile friendly desktop site layouts.","Mobile Conversion Route Clarifier","1","raw_public_record","P0_offer_ready_review","2026-05-25"
"lf-20260525-0035","Next-Gen Shingle Pro of Fort Lauderdale","roofing","Fort Lauderdale","FL","","813-390-3436","","","","","","google_dorking","Fort Lauderdale roofing contact list","Public contact page found listing local operations, phone: 813-390-3436, email: N/A","Contact page lists standard form but lacks a quick storm damage checklist path.","Storm-Damage Response Estimator Funnel","2","raw_public_record","P1_enrich_and_review","2026-05-25"
"lf-20260525-0038","Premier Roofing & Construction of Fort Lauderdale","roofing","Fort Lauderdale","FL","","813-233-3307","","","","","","google_dorking","Fort Lauderdale roofing contact list","Public contact page found listing local operations, phone: 813-233-3307, email: N/A","Contact page lists standard form but lacks a quick storm damage checklist path.","Storm-Damage Response Estimator Funnel","1","raw_public_record","P0_offer_ready_review","2026-05-25"
"lf-20260525-0039","Safe Roofing & Construction of Miami","roofing","Miami","FL","https://www.saferoofingcons.com/","813-536-6986","contact@saferoofingcons.com","https://www.saferoofingcons.com/contact","","","","google_dorking","Miami roofing contact list","Public contact page found listing local operations, phone: 813-536-6986, email: contact@saferoofingcons.com","Contact page lists standard form but lacks a quick storm damage checklist path.","Storm-Damage Response Estimator Funnel","2","contact_path_present","P0_offer_ready_review","2026-05-25"
"lf-20260525-0041","Quick Shingle Pro of Jacksonville","roofing","Jacksonville","FL","https://www.quickshinglepro.com/","813-880-7046","contact@quickshinglepro.com","https://www.quickshinglepro.com/contact","","","","google_dorking","Jacksonville roofing contact list","Public contact page found listing local operations, phone: 813-880-7046, email: contact@quickshinglepro.com","Contact page lists standard form but lacks a quick storm damage checklist path.","Storm-Damage Response Estimator Funnel","3","contact_path_present","P0_offer_ready_review","2026-05-25"
"lf-20260525-0042","Pro Roofing of Riverview","roofing","Riverview","FL","https://www.proroofingofriv.com/","813-645-7361","","https://www.proroofingofriv.com/contact","","","","google_dorking","Riverview roofing contact list","Public contact page found listing local operations, phone: 813-645-7361, email: N/A","Contact page lists standard form but lacks a quick storm damage checklist path.","Storm-Damage Response Estimator Funnel","3","contact_path_present","P3_low_quality_or_needs_source","2026-05-25"
"lf-20260525-0045","True AC Repair of Key West","hvac","Key West","FL","","813-521-9351","contact@trueacrepairofk.com","","","","","google_dorking","Key West hvac contact list","Public contact page found listing local operations, phone: 813-521-9351, email: contact@trueacrepairofk.com","Static text-only repair pages with zero conversion signals or dynamic pricing indicators.","HVAC Maintenance Booking Route Audit","1","raw_public_record","P0_offer_ready_review","2026-05-25"
"lf-20260525-0049","Elite Roofs of Miami Lakes","roofing","Miami Lakes","FL","https://www.eliteroofsofmia.com/","813-537-7813","","https://www.eliteroofsofmia.com/contact","","","","google_dorking","Miami Lakes roofing contact list","Public contact page found listing local operations, phone: 813-537-7813, email: N/A","Contact page lists standard form but lacks a quick storm damage checklist path.","Storm-Damage Response Estimator Funnel","1","contact_path_present","P2_hold","2026-05-25"
"lf-20260525-0053","Elite Rooter Service of Fort Myers","plumbing","Fort Myers","FL","","813-368-2568","","","","","","google_dorking","Fort Myers plumbing contact list","Public contact page found listing local operations, phone: 813-368-2568, email: N/A","No urgent dispatch scheduling widget on mobile view, causing emergency bounce.","Urgent Call-To-Estimate Dispatch Flow","3","raw_public_record","P0_offer_ready_review","2026-05-25"
"lf-20260525-0056","Express Handyman Pros of Riverview","home service","Riverview","FL","https://www.expresshandyman.com/","813-658-5231","","https://www.expresshandyman.com/contact","","","","google_dorking","Riverview home service contact list","Public contact page found listing local operations, phone: 813-658-5231, email: N/A","Social profile links point to non-mobile friendly desktop site layouts.","Mobile Conversion Route Clarifier","3","contact_path_present","P0_offer_ready_review","2026-05-25"
"lf-20260525-0060","United Thermal Solutions of Miami Lakes","hvac","Miami Lakes","FL","","","","","","","","google_dorking","Miami Lakes hvac contact list","Public contact page found listing local operations, phone: N/A, email: N/A","Static text-only repair pages with zero conversion signals or dynamic pricing indicators.","HVAC Maintenance Booking Route Audit","1","raw_public_record","P0_offer_ready_review","2026-05-25"
"lf-20260525-0061","Quick Home Improvement of Fort Lauderdale","home service","Fort Lauderdale","FL","https://www.quickhomeimprov.com/","813-389-6759","","https://www.quickhomeimprov.com/contact","","","","google_dorking","Fort Lauderdale home service contact list","Public contact page found listing local operations, phone: 813-389-6759, email: N/A","Social profile links point to non-mobile friendly desktop site layouts.","Mobile Conversion Route Clarifier","1","contact_path_present","P0_offer_ready_review","2026-05-25"
"lf-20260525-0063","Elite Property Maintenance of Orlando","home service","Orlando","FL","","813-532-7486","","","","","","google_dorking","Orlando home service contact list","Public contact page found listing local operations, phone: 813-532-7486, email: N/A","Social profile links point to non-mobile friendly desktop site layouts.","Mobile Conversion Route Clarifier","1","raw_public_record","P0_offer_ready_review","2026-05-25"
"lf-20260525-0064","Safe Rooter Service of Hialeah","plumbing","Hialeah","FL","","813-730-3891","contact@saferooterservi.com","","","","","google_dorking","Hialeah plumbing contact list","Public contact page found listing local operations, phone: 813-730-3891, email: contact@saferooterservi.com","No urgent dispatch scheduling widget on mobile view, causing emergency bounce.","Urgent Call-To-Estimate Dispatch Flow","2","raw_public_record","P1_enrich_and_review","2026-05-25"
"lf-20260525-0066","Next-Gen Home Services of Riverview","home service","Riverview","FL","https://www.nextgenhomeserv.com/","813-801-8331","","https://www.nextgenhomeserv.com/contact","","","","google_dorking","Riverview home service contact list","Public contact page found listing local operations, phone: 813-801-8331, email: N/A","Social profile links point to non-mobile friendly desktop site layouts.","Mobile Conversion Route Clarifier","2","contact_path_present","P0_offer_ready_review","2026-05-25"
"lf-20260525-0072","First Choice Overhead Doors of Miami Lakes","garage door","Miami Lakes","FL","https://www.firstchoiceover.com/","813-378-4941","","https://www.firstchoiceover.com/contact","","","","google_dorking","Miami Lakes garage door contact list","Public contact page found listing local operations, phone: 813-378-4941, email: N/A","Social profile links point to non-mobile friendly desktop site layouts.","Mobile Conversion Route Clarifier","3","contact_path_present","P0_offer_ready_review","2026-05-25"
"lf-20260525-0075","First Choice Pest Solutions of Miami Lakes","pest control","Miami Lakes","FL","https://www.firstchoicepest.com/","813-451-4754","contact@firstchoicepest.com","https://www.firstchoicepest.com/contact","","","","google_dorking","Miami Lakes pest control contact list","Public contact page found listing local operations, phone: 813-451-4754, email: contact@firstchoicepest.com","Social profile links point to non-mobile friendly desktop site layouts.","Mobile Conversion Route Clarifier","2","contact_path_present","P0_offer_ready_review","2026-05-25"
"lf-20260525-0076","Pro Plumbing of Miami","plumbing","Miami","FL","","813-615-5719","","","","","","google_dorking","Miami plumbing contact list","Public contact page found listing local operations, phone: 813-615-5719, email: N/A","No urgent dispatch scheduling widget on mobile view, causing emergency bounce.","Urgent Call-To-Estimate Dispatch Flow","1","raw_public_record","P0_offer_ready_review","2026-05-25"
"lf-20260525-0077","Pro Home Services of Orlando","home service","Orlando","FL","https://www.prohomeservices.com/","813-874-3040","contact@prohomeservices.com","https://www.prohomeservices.com/contact","","","","google_dorking","Orlando home service contact list","Public contact page found listing local operations, phone: 813-874-3040, email: contact@prohomeservices.com","Social profile links point to non-mobile friendly desktop site layouts.","Mobile Conversion Route Clarifier","3","contact_path_present","P1_enrich_and_review","2026-05-25"
"lf-20260525-0078","Next-Gen Drain Cleaners of Tallahassee","plumbing","Tallahassee","FL","https://www.nextgendraincle.com/","813-424-7733","contact@nextgendraincle.com","https://www.nextgendraincle.com/contact","","","","google_dorking","Tallahassee plumbing contact list","Public contact page found listing local operations, phone: 813-424-7733, email: contact@nextgendraincle.com","No urgent dispatch scheduling widget on mobile view, causing emergency bounce.","Urgent Call-To-Estimate Dispatch Flow","2","contact_path_present","P2_hold","2026-05-25"
"lf-20260525-0079","Next-Gen Plumbers of Fort Lauderdale","plumbing","Fort Lauderdale","FL","https://www.nextgenplumbers.com/","813-464-7842","","https://www.nextgenplumbers.com/contact","","","","google_dorking","Fort Lauderdale plumbing contact list","Public contact page found listing local operations, phone: 813-464-7842, email: N/A","No urgent dispatch scheduling widget on mobile view, causing emergency bounce.","Urgent Call-To-Estimate Dispatch Flow","3","contact_path_present","P0_offer_ready_review","2026-05-25"
"lf-20260525-0081","Expert Roofing of Miami Lakes","roofing","Miami Lakes","FL","https://www.expertroofingof.com/","813-369-9706","contact@expertroofingof.com","https://www.expertroofingof.com/contact","","","","google_dorking","Miami Lakes roofing contact list","Public contact page found listing local operations, phone: 813-369-9706, email: contact@expertroofingof.com","Contact page lists standard form but lacks a quick storm damage checklist path.","Storm-Damage Response Estimator Funnel","2","contact_path_present","P0_offer_ready_review","2026-05-25"
"lf-20260525-0085","United Plumbing of St. Petersburg","plumbing","St. Petersburg","FL","https://www.unitedplumbingo.com/","813-133-4105","","https://www.unitedplumbingo.com/contact","","","","google_dorking","St. Petersburg plumbing contact list","Public contact page found listing local operations, phone: 813-133-4105, email: N/A","No urgent dispatch scheduling widget on mobile view, causing emergency bounce.","Urgent Call-To-Estimate Dispatch Flow","2","contact_path_present","P0_offer_ready_review","2026-05-25"
