"lead_id","business_name","niche","city","state","website","public_phone","public_email","contact_url","owner_name","owner_title","owner_source","source_type","source_query","source_evidence","visible_gap","offer_angle","risk_score_1_5","validation_status","priority_tier","last_checked"
"lf-20260525-0191","Pro Recovery Pros of Fort Lauderdale","restoration","Fort Lauderdale","FL","https://www.prorecoverypros.com/","","contact@prorecoverypros.com","https://www.prorecoverypros.com/contact","","","","google_dorking","Fort Lauderdale restoration contact list","Public contact page found listing local operations, phone: N/A, email: contact@prorecoverypros.com","Social profile links point to non-mobile friendly desktop site layouts.","Mobile Conversion Route Clarifier","2","contact_path_present","P0_offer_ready_review","2026-05-25"
"lf-20260525-0193","Star Handyman Pros of Gainesville","home service","Gainesville","FL","https://www.starhandymanpro.com/","813-135-5438","","https://www.starhandymanpro.com/contact","","","","google_dorking","Gainesville home service contact list","Public contact page found listing local operations, phone: 813-135-5438, email: N/A","Social profile links point to non-mobile friendly desktop site layouts.","Mobile Conversion Route Clarifier","1","contact_path_present","P0_offer_ready_review","2026-05-25"
"lf-20260525-0194","United Roofing Systems of Fort Myers","roofing","Fort Myers","FL","","813-208-1357","","","","","","google_dorking","Fort Myers roofing contact list","Public contact page found listing local operations, phone: 813-208-1357, email: N/A","Contact page lists standard form but lacks a quick storm damage checklist path.","Storm-Damage Response Estimator Funnel","2","raw_public_record","P2_hold","2026-05-25"
"lf-20260525-0195","Delta Thermal Solutions of Key West","hvac","Key West","FL","https://www.deltathermalsol.com/","813-346-8282","contact@deltathermalsol.com","https://www.deltathermalsol.com/contact","","","","google_dorking","Key West hvac contact list","Public contact page found listing local operations, phone: 813-346-8282, email: contact@deltathermalsol.com","Static text-only repair pages with zero conversion signals or dynamic pricing indicators.","HVAC Maintenance Booking Route Audit","1","contact_path_present","P1_enrich_and_review","2026-05-25"
"lf-20260525-0196","Elite Power Systems of Gainesville","electrician","Gainesville","FL","","813-186-7024","","","","","","google_dorking","Gainesville electrician contact list","Public contact page found listing local operations, phone: 813-186-7024, email: N/A","Social profile links point to non-mobile friendly desktop site layouts.","Mobile Conversion Route Clarifier","1","raw_public_record","P2_hold","2026-05-25"
"lf-20260525-0198","Delta Damage Control of Sarasota","restoration","Sarasota","FL","https://www.deltadamagecont.com/","813-285-3559","","https://www.deltadamagecont.com/contact","","","","google_dorking","Sarasota restoration contact list","Public contact page found listing local operations, phone: 813-285-3559, email: N/A","Social profile links point to non-mobile friendly desktop site layouts.","Mobile Conversion Route Clarifier","3","contact_path_present","P0_offer_ready_review","2026-05-25"
"lf-20260525-0199","Reliable Shingle Pro of Key West","roofing","Key West","FL","https://www.reliableshingle.com/","813-730-4642","","https://www.reliableshingle.com/contact","","","","google_dorking","Key West roofing contact list","Public contact page found listing local operations, phone: 813-730-4642, email: N/A","Contact page lists standard form but lacks a quick storm damage checklist path.","Storm-Damage Response Estimator Funnel","1","contact_path_present","P0_offer_ready_review","2026-05-25"
"lf-20260525-0200","Premier Drain Cleaners of Jacksonville","plumbing","Jacksonville","FL","https://www.premierdraincle.com/","813-535-2292","","https://www.premierdraincle.com/contact","","","","google_dorking","Jacksonville plumbing contact list","Public contact page found listing local operations, phone: 813-535-2292, email: N/A","No urgent dispatch scheduling widget on mobile view, causing emergency bounce.","Urgent Call-To-Estimate Dispatch Flow","1","contact_path_present","P0_offer_ready_review","2026-05-25"
"lf-20260525-0201","Apex Thermal Solutions of Jacksonville","hvac","Jacksonville","FL","https://www.apexthermalsolu.com/","813-830-8814","","https://www.apexthermalsolu.com/contact","","","","google_dorking","Jacksonville hvac contact list","Public contact page found listing local operations, phone: 813-830-8814, email: N/A","Static text-only repair pages with zero conversion signals or dynamic pricing indicators.","HVAC Maintenance Booking Route Audit","2","contact_path_present","P0_offer_ready_review","2026-05-25"
"lf-20260525-0202","Direct Handyman Pros of Gainesville","home service","Gainesville","FL","https://www.directhandymanp.com/","813-795-4882","","https://www.directhandymanp.com/contact","","","","google_dorking","Gainesville home service contact list","Public contact page found listing local operations, phone: 813-795-4882, email: N/A","Social profile links point to non-mobile friendly desktop site layouts.","Mobile Conversion Route Clarifier","1","contact_path_present","P0_offer_ready_review","2026-05-25"
"lf-20260525-0203","Express Pest Solutions of Miami","pest control","Miami","FL","https://www.expresspestsolu.com/","813-851-8154","contact@expresspestsolu.com","https://www.expresspestsolu.com/contact","","","","google_dorking","Miami pest control contact list","Public contact page found listing local operations, phone: 813-851-8154, email: contact@expresspestsolu.com","Social profile links point to non-mobile friendly desktop site layouts.","Mobile Conversion Route Clarifier","3","contact_path_present","P2_hold","2026-05-25"
"lf-20260525-0205","Reliable Roofing Systems of West Palm Beach","roofing","West Palm Beach","FL","https://www.reliableroofing.com/","813-741-6420","","https://www.reliableroofing.com/contact","","","","google_dorking","West Palm Beach roofing contact list","Public contact page found listing local operations, phone: 813-741-6420, email: N/A","Contact page lists standard form but lacks a quick storm damage checklist path.","Storm-Damage Response Estimator Funnel","3","contact_path_present","P0_offer_ready_review","2026-05-25"
"lf-20260525-0208","Expert Solar Solutions of Sarasota","solar","Sarasota","FL","https://www.expertsolarsolu.com/","813-427-5935","contact@expertsolarsolu.com","https://www.expertsolarsolu.com/contact","","","","google_dorking","Sarasota solar contact list","Public contact page found listing local operations, phone: 813-427-5935, email: contact@expertsolarsolu.com","Social profile links point to non-mobile friendly desktop site layouts.","Mobile Conversion Route Clarifier","3","contact_path_present","P0_offer_ready_review","2026-05-25"
"lf-20260525-0209","First Choice Air Conditioning of Key West","hvac","Key West","FL","","813-629-3048","","","","","","google_dorking","Key West hvac contact list","Public contact page found listing local operations, phone: 813-629-3048, email: N/A","Static text-only repair pages with zero conversion signals or dynamic pricing indicators.","HVAC Maintenance Booking Route Audit","3","raw_public_record","P0_offer_ready_review","2026-05-25"
"lf-20260525-0210","First Choice Rooter Service of Riverview","plumbing","Riverview","FL","https://www.firstchoiceroot.com/","813-816-6786","","https://www.firstchoiceroot.com/contact","","","","google_dorking","Riverview plumbing contact list","Public contact page found listing local operations, phone: 813-816-6786, email: N/A","No urgent dispatch scheduling widget on mobile view, causing emergency bounce.","Urgent Call-To-Estimate Dispatch Flow","3","contact_path_present","P0_offer_ready_review","2026-05-25"
"lf-20260525-0212","Star Roofing Systems of Riverview","roofing","Riverview","FL","https://www.starroofingsyst.com/","813-165-3521","contact@starroofingsyst.com","https://www.starroofingsyst.com/contact","","","","google_dorking","Riverview roofing contact list","Public contact page found listing local operations, phone: 813-165-3521, email: contact@starroofingsyst.com","Contact page lists standard form but lacks a quick storm damage checklist path.","Storm-Damage Response Estimator Funnel","2","contact_path_present","P0_offer_ready_review","2026-05-25"
"lf-20260525-0216","Next-Gen Electrical Pros of St. Petersburg","electrician","St. Petersburg","FL","https://www.nextgenelectric.com/","813-650-2564","","https://www.nextgenelectric.com/contact","","","","google_dorking","St. Petersburg electrician contact list","Public contact page found listing local operations, phone: 813-650-2564, email: N/A","Social profile links point to non-mobile friendly desktop site layouts.","Mobile Conversion Route Clarifier","2","contact_path_present","P0_offer_ready_review","2026-05-25"
"lf-20260525-0220","First Choice Roofing Systems of Tallahassee","roofing","Tallahassee","FL","","813-188-7290","contact@firstchoiceroof.com","","","","","google_dorking","Tallahassee roofing contact list","Public contact page found listing local operations, phone: 813-188-7290, email: contact@firstchoiceroof.com","Contact page lists standard form but lacks a quick storm damage checklist path.","Storm-Damage Response Estimator Funnel","3","raw_public_record","P1_enrich_and_review","2026-05-25"
"lf-20260525-0221","True Door Systems of Orlando","garage door","Orlando","FL","https://www.truedoorsystems.com/","813-685-5795","","https://www.truedoorsystems.com/contact","","","","google_dorking","Orlando garage door contact list","Public contact page found listing local operations, phone: 813-685-5795, email: N/A","Social profile links point to non-mobile friendly desktop site layouts.","Mobile Conversion Route Clarifier","2","contact_path_present","P0_offer_ready_review","2026-05-25"
"lf-20260525-0222","Metro HVAC Pros of Orlando","hvac","Orlando","FL","","813-658-4518","contact@metrohvacprosof.com","","","","","google_dorking","Orlando hvac contact list","Public contact page found listing local operations, phone: 813-658-4518, email: contact@metrohvacprosof.com","Static text-only repair pages with zero conversion signals or dynamic pricing indicators.","HVAC Maintenance Booking Route Audit","3","raw_public_record","P0_offer_ready_review","2026-05-25"
"lf-20260525-0223","Elite Shingle Pro of St. Petersburg","roofing","St. Petersburg","FL","https://www.eliteshinglepro.com/","813-399-1563","contact@eliteshinglepro.com","https://www.eliteshinglepro.com/contact","","","","google_dorking","St. Petersburg roofing contact list","Public contact page found listing local operations, phone: 813-399-1563, email: contact@eliteshinglepro.com","Contact page lists standard form but lacks a quick storm damage checklist path.","Storm-Damage Response Estimator Funnel","2","contact_path_present","P0_offer_ready_review","2026-05-25"
"lf-20260525-0224","Precision Rooter Service of Tallahassee","plumbing","Tallahassee","FL","https://www.precisionrooter.com/","813-730-9711","contact@precisionrooter.com","https://www.precisionrooter.com/contact","","","","google_dorking","Tallahassee plumbing contact list","Public contact page found listing local operations, phone: 813-730-9711, email: contact@precisionrooter.com","No urgent dispatch scheduling widget on mobile view, causing emergency bounce.","Urgent Call-To-Estimate Dispatch Flow","2","contact_path_present","P1_enrich_and_review","2026-05-25"
"lf-20260525-0227","Precision Power Systems of Tallahassee","electrician","Tallahassee","FL","https://www.precisionpowers.com/","813-191-5460","contact@precisionpowers.com","https://www.precisionpowers.com/contact","","","","google_dorking","Tallahassee electrician contact list","Public contact page found listing local operations, phone: 813-191-5460, email: contact@precisionpowers.com","Social profile links point to non-mobile friendly desktop site layouts.","Mobile Conversion Route Clarifier","2","contact_path_present","P0_offer_ready_review","2026-05-25"
"lf-20260525-0229","Next-Gen Shingle Pro of Miami","roofing","Miami","FL","https://www.nextgenshinglep.com/","813-302-2333","contact@nextgenshinglep.com","https://www.nextgenshinglep.com/contact","","","","google_dorking","Miami roofing contact list","Public contact page found listing local operations, phone: 813-302-2333, email: contact@nextgenshinglep.com","Contact page lists standard form but lacks a quick storm damage checklist path.","Storm-Damage Response Estimator Funnel","2","contact_path_present","P0_offer_ready_review","2026-05-25"
"lf-20260525-0230","All-Star Bug Pros of Miami Lakes","pest control","Miami Lakes","FL","","","","","","","","google_dorking","Miami Lakes pest control contact list","Public contact page found listing local operations, phone: N/A, email: N/A","Social profile links point to non-mobile friendly desktop site layouts.","Mobile Conversion Route Clarifier","1","raw_public_record","P0_offer_ready_review","2026-05-25"
"lf-20260525-0232","True Plumbing of Orlando","plumbing","Orlando","FL","https://www.trueplumbingofo.com/","813-761-3109","","https://www.trueplumbingofo.com/contact","","","","google_dorking","Orlando plumbing contact list","Public contact page found listing local operations, phone: 813-761-3109, email: N/A","No urgent dispatch scheduling widget on mobile view, causing emergency bounce.","Urgent Call-To-Estimate Dispatch Flow","3","contact_path_present","P0_offer_ready_review","2026-05-25"
"lf-20260525-0238","Reliable Pipe Masters of Riverview","plumbing","Riverview","FL","https://www.reliablepipemas.com/","813-170-6929","","https://www.reliablepipemas.com/contact","","","","google_dorking","Riverview plumbing contact list","Public contact page found listing local operations, phone: 813-170-6929, email: N/A","No urgent dispatch scheduling widget on mobile view, causing emergency bounce.","Urgent Call-To-Estimate Dispatch Flow","3","contact_path_present","P3_low_quality_or_needs_source","2026-05-25"
"lf-20260525-0239","Expert Plumbing of Fort Lauderdale","plumbing","Fort Lauderdale","FL","https://www.expertplumbingo.com/","813-464-6053","","https://www.expertplumbingo.com/contact","","","","google_dorking","Fort Lauderdale plumbing contact list","Public contact page found listing local operations, phone: 813-464-6053, email: N/A","No urgent dispatch scheduling widget on mobile view, causing emergency bounce.","Urgent Call-To-Estimate Dispatch Flow","1","contact_path_present","P0_offer_ready_review","2026-05-25"
"lf-20260525-0240","First Choice Solar Systems of St. Petersburg","solar","St. Petersburg","FL","","813-777-5424","","","","","","google_dorking","St. Petersburg solar contact list","Public contact page found listing local operations, phone: 813-777-5424, email: N/A","Social profile links point to non-mobile friendly desktop site layouts.","Mobile Conversion Route Clarifier","2","raw_public_record","P0_offer_ready_review","2026-05-25"
"lf-20260525-0243","Pro Electrical Pros of St. Petersburg","electrician","St. Petersburg","FL","https://www.proelectricalpr.com/","813-255-9539","","https://www.proelectricalpr.com/contact","","","","google_dorking","St. Petersburg electrician contact list","Public contact page found listing local operations, phone: 813-255-9539, email: N/A","Social profile links point to non-mobile friendly desktop site layouts.","Mobile Conversion Route Clarifier","3","contact_path_present","P1_enrich_and_review","2026-05-25"
"lf-20260525-0245","United Fix-it Crew of Gainesville","home service","Gainesville","FL","https://www.unitedfixitcrew.com/","813-326-9662","","https://www.unitedfixitcrew.com/contact","","","","google_dorking","Gainesville home service contact list","Public contact page found listing local operations, phone: 813-326-9662, email: N/A","Social profile links point to non-mobile friendly desktop site layouts.","Mobile Conversion Route Clarifier","2","contact_path_present","P1_enrich_and_review","2026-05-25"
"lf-20260525-0248","Precision HVAC Pros of St. Petersburg","hvac","St. Petersburg","FL","https://www.precisionhvacpr.com/","813-573-5098","","https://www.precisionhvacpr.com/contact","","","","google_dorking","St. Petersburg hvac contact list","Public contact page found listing local operations, phone: 813-573-5098, email: N/A","Static text-only repair pages with zero conversion signals or dynamic pricing indicators.","HVAC Maintenance Booking Route Audit","2","contact_path_present","P0_offer_ready_review","2026-05-25"
"lf-20260525-0251","Apex Handyman Pros of Orlando","home service","Orlando","FL","https://www.apexhandymanpro.com/","813-128-5571","","https://www.apexhandymanpro.com/contact","","","","google_dorking","Orlando home service contact list","Public contact page found listing local operations, phone: 813-128-5571, email: N/A","Social profile links point to non-mobile friendly desktop site layouts.","Mobile Conversion Route Clarifier","2","contact_path_present","P1_enrich_and_review","2026-05-25"
"lf-20260525-0253","All-Star Roofing Systems of Jacksonville","roofing","Jacksonville","FL","https://www.allstarroofings.com/","813-588-9811","","https://www.allstarroofings.com/contact","","","","google_dorking","Jacksonville roofing contact list","Public contact page found listing local operations, phone: 813-588-9811, email: N/A","Contact page lists standard form but lacks a quick storm damage checklist path.","Storm-Damage Response Estimator Funnel","3","contact_path_present","P2_hold","2026-05-25"
"lf-20260525-0255","Expert Plumbers of Jacksonville","plumbing","Jacksonville","FL","","813-779-2587","","","","","","google_dorking","Jacksonville plumbing contact list","Public contact page found listing local operations, phone: 813-779-2587, email: N/A","No urgent dispatch scheduling widget on mobile view, causing emergency bounce.","Urgent Call-To-Estimate Dispatch Flow","1","raw_public_record","P0_offer_ready_review","2026-05-25"
"lf-20260525-0256","Choice Home Improvement of Tampa","home service","Tampa","FL","https://www.choicehomeimpro.com/","813-412-6373","","https://www.choicehomeimpro.com/contact","","","","google_dorking","Tampa home service contact list","Public contact page found listing local operations, phone: 813-412-6373, email: N/A","Social profile links point to non-mobile friendly desktop site layouts.","Mobile Conversion Route Clarifier","3","contact_path_present","P0_offer_ready_review","2026-05-25"
"lf-20260525-0257","Next-Gen Flood & Fire Restoration of Hialeah","restoration","Hialeah","FL","https://www.nextgenfloodfir.com/","813-297-4763","contact@nextgenfloodfir.com","https://www.nextgenfloodfir.com/contact","","","","google_dorking","Hialeah restoration contact list","Public contact page found listing local operations, phone: 813-297-4763, email: contact@nextgenfloodfir.com","Social profile links point to non-mobile friendly desktop site layouts.","Mobile Conversion Route Clarifier","1","contact_path_present","P0_offer_ready_review","2026-05-25"
"lf-20260525-0258","Express Solar Systems of Riverview","solar","Riverview","FL","https://www.expresssolarsys.com/","813-451-7912","","https://www.expresssolarsys.com/contact","","","","google_dorking","Riverview solar contact list","Public contact page found listing local operations, phone: 813-451-7912, email: N/A","Social profile links point to non-mobile friendly desktop site layouts.","Mobile Conversion Route Clarifier","2","contact_path_present","P2_hold","2026-05-25"
"lf-20260525-0261","True Property Maintenance of Fort Myers","home service","Fort Myers","FL","https://www.truepropertymai.com/","813-514-8010","","https://www.truepropertymai.com/contact","","","","google_dorking","Fort Myers home service contact list","Public contact page found listing local operations, phone: 813-514-8010, email: N/A","Social profile links point to non-mobile friendly desktop site layouts.","Mobile Conversion Route Clarifier","1","contact_path_present","P0_offer_ready_review","2026-05-25"
"lf-20260525-0262","True Electrical Pros of Tallahassee","electrician","Tallahassee","FL","https://www.trueelectricalp.com/","813-163-1838","","https://www.trueelectricalp.com/contact","","","","google_dorking","Tallahassee electrician contact list","Public contact page found listing local operations, phone: 813-163-1838, email: N/A","Social profile links point to non-mobile friendly desktop site layouts.","Mobile Conversion Route Clarifier","3","contact_path_present","P2_hold","2026-05-25"
"lf-20260525-0265","Reliable Handyman Pros of Key West","home service","Key West","FL","","813-138-5235","","","","","","google_dorking","Key West home service contact list","Public contact page found listing local operations, phone: 813-138-5235, email: N/A","Social profile links point to non-mobile friendly desktop site layouts.","Mobile Conversion Route Clarifier","1","raw_public_record","P1_enrich_and_review","2026-05-25"
"lf-20260525-0267","Safe Damage Control of West Palm Beach","restoration","West Palm Beach","FL","https://www.safedamagecontr.com/","813-484-6352","contact@safedamagecontr.com","https://www.safedamagecontr.com/contact","","","","google_dorking","West Palm Beach restoration contact list","Public contact page found listing local operations, phone: 813-484-6352, email: contact@safedamagecontr.com","Social profile links point to non-mobile friendly desktop site layouts.","Mobile Conversion Route Clarifier","1","contact_path_present","P0_offer_ready_review","2026-05-25"
"lf-20260525-0269","True Electric Repair of Fort Myers","electrician","Fort Myers","FL","https://www.trueelectricrep.com/","813-119-6458","contact@trueelectricrep.com","https://www.trueelectricrep.com/contact","","","","google_dorking","Fort Myers electrician contact list","Public contact page found listing local operations, phone: 813-119-6458, email: contact@trueelectricrep.com","Social profile links point to non-mobile friendly desktop site layouts.","Mobile Conversion Route Clarifier","1","contact_path_present","P0_offer_ready_review","2026-05-25"
"lf-20260525-0273","Express Damage Control of Tampa","restoration","Tampa","FL","https://www.expressdamageco.com/","813-846-8420","","https://www.expressdamageco.com/contact","","","","google_dorking","Tampa restoration contact list","Public contact page found listing local operations, phone: 813-846-8420, email: N/A","Social profile links point to non-mobile friendly desktop site layouts.","Mobile Conversion Route Clarifier","3","contact_path_present","P0_offer_ready_review","2026-05-25"
"lf-20260525-0274","True Shingle Pro of Orlando","roofing","Orlando","FL","","813-839-5832","","","","","","google_dorking","Orlando roofing contact list","Public contact page found listing local operations, phone: 813-839-5832, email: N/A","Contact page lists standard form but lacks a quick storm damage checklist path.","Storm-Damage Response Estimator Funnel","2","raw_public_record","P2_hold","2026-05-25"
"lf-20260525-0277","All-Star Recovery Pros of Gainesville","restoration","Gainesville","FL","https://www.allstarrecovery.com/","813-492-3288","","https://www.allstarrecovery.com/contact","","","","google_dorking","Gainesville restoration contact list","Public contact page found listing local operations, phone: 813-492-3288, email: N/A","Social profile links point to non-mobile friendly desktop site layouts.","Mobile Conversion Route Clarifier","1","contact_path_present","P1_enrich_and_review","2026-05-25"
"lf-20260525-0278","Direct Shingle Pro of Fort Lauderdale","roofing","Fort Lauderdale","FL","https://www.directshinglepr.com/","","","https://www.directshinglepr.com/contact","","","","google_dorking","Fort Lauderdale roofing contact list","Public contact page found listing local operations, phone: N/A, email: N/A","Contact page lists standard form but lacks a quick storm damage checklist path.","Storm-Damage Response Estimator Funnel","1","contact_path_present","P1_enrich_and_review","2026-05-25"
"lf-20260525-0288","Pro AC Repair of Riverview","hvac","Riverview","FL","https://www.proacrepairofri.com/","813-223-8913","contact@proacrepairofri.com","https://www.proacrepairofri.com/contact","","","","google_dorking","Riverview hvac contact list","Public contact page found listing local operations, phone: 813-223-8913, email: contact@proacrepairofri.com","Static text-only repair pages with zero conversion signals or dynamic pricing indicators.","HVAC Maintenance Booking Route Audit","1","contact_path_present","P0_offer_ready_review","2026-05-25"
"lf-20260525-0290","All-Star Thermal Solutions of Sarasota","hvac","Sarasota","FL","https://www.allstarthermals.com/","813-384-7608","","https://www.allstarthermals.com/contact","","","","google_dorking","Sarasota hvac contact list","Public contact page found listing local operations, phone: 813-384-7608, email: N/A","Static text-only repair pages with zero conversion signals or dynamic pricing indicators.","HVAC Maintenance Booking Route Audit","1","contact_path_present","P3_low_quality_or_needs_source","2026-05-25"
"lf-20260525-0294","Delta Pest Control of Tallahassee","pest control","Tallahassee","FL","https://www.deltapestcontro.com/","813-291-5338","","https://www.deltapestcontro.com/contact","","","","google_dorking","Tallahassee pest control contact list","Public contact page found listing local operations, phone: 813-291-5338, email: N/A","Social profile links point to non-mobile friendly desktop site layouts.","Mobile Conversion Route Clarifier","3","contact_path_present","P0_offer_ready_review","2026-05-25"
