lead_id,business_name,niche,city,state,website,public_phone,public_email,contact_url,owner_name,owner_title,owner_source,source_type,source_query,source_evidence,visible_gap,offer_angle,risk_score_1_5,validation_status,priority_tier,last_checked
,Jarman Sales & Service Inc,hvac,Philadelphia,PA,https://jarmansalesandservice.com/,+1-215-389-2345,jarmansales@gmail.com,https://jarmansalesandservice.com/,"Robert Jarman",President,https://www.bbb.org/us/pa/philadelphia/profile/air-conditioning-contractor/jarman-sales-service-inc-0241-80001145,public_web,"Jarman Sales & Service Philadelphia owner BBB official site","Official Jarman site confirms Philadelphia air-conditioning service, address, phone, email, and long-running family-owned operation; BBB lists Robert Jarman as President for Jarman Sales & Service Inc.","Official site is usable but lightweight and older-looking, with contact details embedded on the home page instead of a stronger quote/booking flow.","Modernize the Jarman contact path into a cleaner quote flow while preserving the long-standing local family trust signal.",2,reviewed_owner_verified_public_source,A,2026-06-14
,Tinneny Plumbing & Heating Inc,plumbing,Philadelphia,PA,https://www.tinnenyplumbing.com/,+1-215-487-3113,,https://www.tinnenyplumbing.com/,"Bruce Tinneny",President,https://www.bbb.org/us/pa/philadelphia/profile/plumber/tinneny-plumbing-heating-inc-0241-80021274,public_web,"Tinneny Plumbing Heating Philadelphia owner BBB official site","BBB confirms Tinneny Plumbing & Heating Inc at 404 Fountain St, Philadelphia, phone 215-487-3113, A+ rating, and Bruce Tinneny as President; public site search confirms the same phone and estimate call path.","Website was intermittently unavailable during direct fetch and appears thin, so the business needs a more resilient first-party intake path.","Build a stable plumbing service landing page and call/estimate path backed by the BBB-listed president and long operating history.",3,reviewed_owner_verified_public_source,A,2026-06-14
,AirMaster Heating & Cooling Specialists,hvac,Philadelphia,PA,https://airmasterpa.com/,+1-215-284-7583,info@airmasterpa.com,https://scheduler.servicetitan.com/,"Thomas Molieri",Owner,https://airmasterpa.com/about/,public_web,"AirMaster Heating Cooling Philadelphia owner official about BBB","Official AirMaster about page names Thomas Molieri as Owner and says he started the company in 2016; BBB corroborates AirMaster, Philadelphia address, service categories, A+ rating, license PA124808, and Thomas Molieri as Owner.","ServiceTitan booking is present, but public paths split between call-now, instant quote, financing, and scheduler links.","Tighten the primary HVAC booking path so emergency calls, quotes, and financing requests route into one clean conversion flow.",1,reviewed_owner_verified_public_source,A,2026-06-14
,Summers Quality Service,hvac,Philadelphia,PA,https://www.summersquality.com/,+1-215-482-8800,,https://www.summersquality.com/contact/,"John Summers",President / Owner,https://www.summersquality.com/about-us/,public_web,"Summers Quality Services Philadelphia owner official about BBB","Official Summers about page names John Summers as owner and describes the company as a second-generation family-owned Philadelphia service business; BBB corroborates John Summers as President, A+ rating, address, phone, and license PA015355.","Strong site and request path exist, but multi-service HVAC/electrical/plumbing navigation can dilute the fastest quote route for urgent HVAC visitors.","Create a cleaner segmented intake path for HVAC, electrical, and plumbing visitors while leaning on the family-owned trust story.",1,reviewed_owner_verified_public_source,A,2026-06-14
,EMCO Tech Heating & Cooling,hvac,Philadelphia,PA,https://emcocooling.com/,+1-215-366-1001,,https://emcocooling.com/contact/,"Serge Tsyplyuk",Technical Director / HVAC Team Leader,https://emcocooling.com/about/,public_web,"EMCO Tech Heating Cooling Philadelphia owner founder Serge official site BBB","Official EMCO site confirms Greater Philadelphia HVAC service, phone, license PA017704, family-operated positioning, and service since 2006; the about page names Serge Tsyplyuk as HVAC team leader and Technical Director who runs field operations.","The site has many service, financing, special, and booking paths, which may create choice overload before the visitor reaches the best booking action.","Simplify EMCO's first-click path for repair, replacement, and emergency booking while preserving license and Google/BBB trust signals.",2,reviewed_decision_maker_verified_public_source,A,2026-06-14
