lead_id,business_name,niche,city,state,website,public_phone,public_email,contact_url,owner_name,owner_title,owner_source,source_type,source_query,source_evidence,visible_gap,offer_angle,risk_score_1_5,validation_status,priority_tier,last_checked
LFR-20260614-0001,Southwest Door & Window,windows_doors,Dallas,TX,https://southwestdw.com/,+1 214-341-2212,,,,,,overpass_public_business_record,Dallas TX windows_doors public business listing,Public business record listed a phone number. Public business record listed a website. Website did not return readable HTML during this run.,"Website is live, but no obvious contact or estimate path was detected on the public page sweep.",Windows_doors contact-path cleanup,2,validated_public_business_source,P0_offer_ready_review,2026-06-14
LFR-20260614-0002,Foster Exteriors Window Company,windows_doors,Dallas,TX,https://www.fosterexteriors.com,+1 214-319-8400,info@fosterexteriors.com,https://www.fosterexteriors.com/contact-us/,,,,overpass_public_business_record,Dallas TX windows_doors public business listing,"Public business record listed a phone number. Public business record listed a website. Public website exposed email info@fosterexteriors.com. Website exposed a contact path at https://www.fosterexteriors.com/contact-us/. Website mentions estimate, quote, inspection, or scheduling language.",Multiple public phone mentions may split the primary conversion path instead of pushing one clean estimate flow.,Windows_doors primary-call routing cleanup,1,validated_public_business_source,P0_offer_ready_review,2026-06-14
LFR-20260614-0003,Century Glass,windows_doors,Dallas,TX,http://centuryglassdallas.com/,,info@centuryglassdallas.com,http://centuryglassdallas.com/contact-2/,,,,overpass_public_business_record,Dallas TX windows_doors public business listing,Public business record listed a website. Public website exposed email info@centuryglassdallas.com. Website exposed a contact path at http://centuryglassdallas.com/contact-2/.,"Contact path exists, but the site did not clearly expose estimate or booking language in the public sweep.",Windows_doors estimate CTA upgrade,1,validated_public_business_source,P0_offer_ready_review,2026-06-14
LFR-20260614-0004,Houston Overhead Garage Door LLC,windows_doors,Houston,TX,http://houstonoverheadgaragedoorllc.com/,+1-713-359-6404,,,,,,overpass_public_business_record,Houston TX windows_doors public business listing,Public business record listed a phone number. Public business record listed a website.,"Website is live, but no obvious contact or estimate path was detected on the public page sweep.",Windows_doors contact-path cleanup,2,validated_public_business_source,P0_offer_ready_review,2026-06-14
LFR-20260614-0005,"Advantage Fence, Inc.",windows_doors,Houston,TX,https://advantage-fence.com,+1-713-426-0670,advantagebtw@yahoo.com,https://www.advantage-fence.com/free-estimate,,,,overpass_public_business_record,Houston TX windows_doors public business listing,"Public business record listed a phone number. Public business record listed a website. Public website exposed email advantagebtw@yahoo.com. Website exposed a contact path at https://www.advantage-fence.com/free-estimate. Website mentions estimate, quote, inspection, or scheduling language.",Multiple public phone mentions may split the primary conversion path instead of pushing one clean estimate flow.,Windows_doors primary-call routing cleanup,1,validated_public_business_source,P0_offer_ready_review,2026-06-14