"lead_id","business_name","niche","city","state","website","public_phone","public_email","contact_url","owner_name","owner_title","owner_source","source_type","source_query","source_evidence","visible_gap","offer_angle","risk_score_1_5","validation_status","priority_tier","last_checked","triage_reason","lead_type","public_research_note","recommended_action","business_address","registration_source","registration_status","registration_notes"
"LFR-20260614-0001","Otto's Exteriors","roofing","Raleigh","NC","https://www.raleighresidentialcontractor.com/","+1-919-301-0066","","","","","","overpass_public_business_record","Raleigh NC roofing public business listing","Public business record listed a phone number. Public business record listed a website.","Website is live, but no obvious contact or estimate path was detected on the public page sweep.","Roofing contact-path cleanup","2","validated_public_business_source","P0_offer_ready_review","2026-06-14","missing_owner;missing_owner_source;missing_first_party_contact_path","roofing local service candidate in Raleigh, NC","Family-owned Raleigh exterior/remodeling business evidence found, but no clean public owner or decision-maker name was verified from official/BBB-style sources in this pass.","continue_public_owner_research_or_move_on","","","",""
"LFR-20260614-0004","Louies Water Damage & Plumbing","plumbing","Raleigh","NC","https://www.louiesrestorationplumbing.com/","+1-919-582-7723","","","","","","overpass_public_business_record","Raleigh NC plumbing public business listing","Public business record listed a phone number. Public business record listed a website. Website did not return readable HTML during this run.","Website is live, but no obvious contact or estimate path was detected on the public page sweep.","Plumbing contact-path cleanup","2","validated_public_business_source","P0_offer_ready_review","2026-06-14","missing_owner;missing_owner_source;missing_first_party_contact_path","plumbing local service candidate in Raleigh, NC","Business identity is visible, but public searches did not verify a clean Raleigh owner/decision-maker source; similarly named out-of-state Louie plumbing records are not safe to merge.","continue_public_owner_research_or_move_on","","","",""
"LFR-20260614-0005","Lane Plumbing","plumbing","Raleigh","NC","https://laneplumbingraleigh.com","+1 919-231-1388","jlane19939@aol.com","","","","","overpass_public_business_record","Raleigh NC plumbing public business listing","Public business record listed a phone number. Public business record listed a website. Public website exposed email jlane19939@aol.com. Website linked to a third-party contact surface instead of a first-party contact path. Website mentions estimate, quote, inspection, or scheduling language.","Website is live, but no obvious contact or estimate path was detected on the public page sweep.","Plumbing contact-path cleanup","2","validated_public_business_source","P0_offer_ready_review","2026-06-14","missing_owner;missing_owner_source;missing_first_party_contact_path","plumbing local service candidate in Raleigh, NC","Official site confirms family-owned Raleigh/Cary plumbing business; social result names Jimmy Lane, but owner evidence is not strong enough beyond social/public profile context for final merge yet.","continue_public_owner_research_or_move_on","","","",""
"LFR-20260614-0007","Raleigh Heating & Air, Inc.","hvac","Raleigh","NC","https://www.raleighheatingandair.com/","+1-919-878-0008","","https://raleighheatingandair.com/contact","","","","overpass_public_business_record","Raleigh NC hvac public business listing","Public business record listed a phone number. Public business record listed a website. Website exposed a contact path at https://raleighheatingandair.com/contact. Website mentions estimate, quote, inspection, or scheduling language.","Public contact path appears to rely on phone-first routing without a clearly exposed email fallback.","Hvac lead-capture follow-up setup","2","validated_public_business_source","P0_offer_ready_review","2026-06-14","missing_owner;missing_owner_source","hvac local service candidate in Raleigh, NC","Official site and BBB confirm Raleigh HVAC business, but owner evidence found so far is LinkedIn-only and not strong enough for reviewed merge.","continue_public_owner_research_or_move_on","","","",""
"LFR-20260614-0009","Maynor","hvac","Raleigh","NC","https://maynorservices.com/","+1 984 2265599;+1 919 3610993","info@maynorservices.com","https://maynorservices.com/contact-us/","","","","overpass_public_business_record","Raleigh NC hvac public business listing","Public business record listed a phone number. Public business record listed a website. Public website exposed email info@maynorservices.com. Website exposed a contact path at https://maynorservices.com/contact-us/. Website mentions estimate, quote, inspection, or scheduling language.","Multiple public phone mentions may split the primary conversion path instead of pushing one clean estimate flow.","Hvac primary-call routing cleanup","1","validated_public_business_source","P0_offer_ready_review","2026-06-14","missing_owner;missing_owner_source","hvac local service candidate in Raleigh, NC","Official site confirms Triangle HVAC/plumbing/electrical business, but no clean owner/decision-maker source was verified in this pass.","continue_public_owner_research_or_move_on","","","",""
"LFR-20260614-0010","Tennessee Standard Plumbing and Drain","plumbing","Knoxville","TN","https://tnstandard.com/","+1-865-352-9003","service@tnstandard.com","https://embed.scheduler.servicetitan.com/","","","","overpass_public_business_record","Knoxville TN plumbing public business listing","Public business record listed a phone number. Public business record listed a website. Public website exposed email service@tnstandard.com. Website exposed a contact path at https://embed.scheduler.servicetitan.com/. Website mentions estimate, quote, inspection, or scheduling language.","Multiple public phone mentions may split the primary conversion path instead of pushing one clean estimate flow.","Plumbing primary-call routing cleanup","1","validated_public_business_source","P0_offer_ready_review","2026-06-14","missing_owner;missing_owner_source","plumbing local service candidate in Knoxville, TN","Official site and reviews mention owner/fifth-generation master plumber context, but no clean owner name was verified from a strong public source.","continue_public_owner_research_or_move_on","","","",""
"LFR-20260614-0011","Knoxville Plumbing & Drain Cleaning","plumbing","Knoxville","TN","https://knoxvilleplumbing.com/","+18656223905","","https://knoxvilleplumbing.com/contact/","","","","overpass_public_business_record","Knoxville TN plumbing public business listing","Public business record listed a phone number. Public business record listed a website. Website exposed a contact path at https://knoxvilleplumbing.com/contact/. Website mentions estimate, quote, inspection, or scheduling language.","Public contact path appears to rely on phone-first routing without a clearly exposed email fallback.","Plumbing lead-capture follow-up setup","2","validated_public_business_source","P0_offer_ready_review","2026-06-14","missing_owner;missing_owner_source","plumbing local service candidate in Knoxville, TN","Official/BBB identity evidence exists for Knoxville Plumbing, but no clean owner or decision-maker was verified in this pass.","continue_public_owner_research_or_move_on","","","",""
